<!ELEMENT PreviousCompilation (XMLLIB_IS_A_PIECE_OF_CRAP)+>
<!ATTLIST PreviousCompilation localityPoints CDATA #REQUIRED >
<!ELEMENT XMLLIB_IS_A_PIECE_OF_CRAP (ENTRY)+>
<!ELEMENT ENTRY EMPTY>
<!ATTLIST ENTRY name CDATA #REQUIRED indexType CDATA #REQUIRED index CDATA #REQUIRED >
